{
  "$schema": "https://anthropic.com/claude-code/marketplace.schema.json",
  "name": "master-plugin-repository",
  "version": "0.1.0",
  "description": "OKX internal Claude Code plugin marketplace for hackathon submissions",
  "owner": {
    "name": "mastersamasama",
    "email": "mastersamasama@users.noreply.github.com"
  },
  "plugins": [
    {
      "name": "official-plugins",
      "description": "Official OKX hackathon tools — package any combination of skills, commands, agents, hooks, scripts, or MCP configs into a Claude Code plugin and submit it to this marketplace",
      "version": "0.1.0",
      "author": {
        "name": "mastersamasama"
      },
      "category": "development",
      "keywords": [
        "hackathon",
        "okx",
        "tooling",
        "internal",
        "official"
      ],
      "source": "./plugins/official-plugins"
    },
    {
      "name": "onchain-redpacket",
      "description": "Onchain red packet agent — create USDC/OKB/SOL red packets on XLayer & Solana and share via link, powered by OKX Agentic Wallet",
      "version": "1.0.1",
      "author": {
        "name": "oker"
      },
      "category": "defi",
      "keywords": [
        "redpacket",
        "onchain",
        "onchainos",
        "okx",
        "defi",
        "payments",
        "xlayer",
        "solana"
      ],
      "source": {
        "source": "url",
        "url": "https://github.com/li-zoe-x/onchain-redpacket.git",
        "sha": "c824279794b26959d659f6ee0cfbf443df76698d"
      }
    },
    {
      "name": "doraemon",
      "description": "Decentralized AI gateway — access 18 frontier models (Claude, GPT-4o, Gemini, DeepSeek, Grok, and more) by paying in USDG on X Layer. No API keys, no accounts, no geo-restrictions.",
      "version": "1.0.0",
      "author": {
        "name": "YunanL"
      },
      "category": "development",
      "keywords": [
        "ai-gateway",
        "x402",
        "usdg",
        "decentralized",
        "llm",
        "okx",
        "xlayer",
        "hackathon"
      ],
      "source": {
        "source": "url",
        "url": "https://github.com/YunanL/doraemon.git",
        "sha": "10aa3ca2f0b68ebeb4cbe98e2b6c489b45ff05df"
      }
    },
    {
      "name": "onchain-arb",
      "description": "CEX-DEX and cross-chain arbitrage opportunity detector powered by onchainOS data",
      "version": "0.1.0",
      "author": {
        "name": "umi"
      },
      "keywords": [
        "hackathon",
        "okx",
        "binance",
        "arbitrage",
        "onchain arbitrage"
      ],
      "source": {
        "source": "url",
        "url": "https://github.com/umiiii/onchain-arb.git",
        "sha": "1ac6a43436a1ef597ecfeb1dabab5d6ea16abefb"
      }
    },
    {
      "name": "sentryx",
      "description": "Your AI-Powered Onchain Security & Alpha Guardian — auto-scans approvals, detects rug pulls, guards your portfolio, trades safely, hunts alpha signals, and runs a bidirectional x402 signal marketplace across EVM and Solana via Onchain OS.",
      "version": "2.0.0",
      "author": {
        "name": "sentryx-team"
      },
      "category": "other",
      "keywords": [
        "security",
        "wallet",
        "defi",
        "onchain-os",
        "agent",
        "agentic-wallet",
        "alpha",
        "trading",
        "x402",
        "signals"
      ],
      "source": "./plugins/sentryx"
    },
    {
      "name": "xiake",
      "description": "侠客擂台 — AI-native wuxia 3v3 chain game with 7 schools, 12 stages, PVP arena, gacha economy",
      "version": "0.1.0",
      "author": {
        "name": "PAtrickpp33"
      },
      "category": "other",
      "keywords": [
        "okx",
        "hackathon",
        "game",
        "wuxia",
        "web3",
        "onchain"
      ],
      "source": {
        "source": "url",
        "url": "https://github.com/PAtrickpp33/Xiake-onchain.git",
        "sha": "b27f1714cc0d9442d6d14161448ecc6c26f593f4"
      }
    },
    {
      "name": "bounty-claim",
      "description": "Automated open-source bounty settlement agent. Verifies a GitHub PR is merged, confirms wallet address from the PR author's own comment, and triggers instant USDC payment on Base via OKX Onchain OS.",
      "version": "1.0.0",
      "author": {
        "name": "Cloriskitty"
      },
      "category": "productivity",
      "keywords": [
        "bounty",
        "github",
        "usdc",
        "onchain-os",
        "open-source",
        "payments",
        "base",
        "defi"
      ],
      "source": "./plugins/bounty-claim"
    },
    {
      "name": "weclaude",
      "description": "Claude API at 90% off for buyers; sellers earn by sharing idle Claude Code capacity — settled on xlayer via x402.",
      "version": "2.2.0",
      "author": {
        "name": "WeClaude"
      },
      "category": "productivity",
      "keywords": [
        "okx",
        "hackathon",
        "claude-api",
        "x402",
        "xlayer"
      ],
      "source": "./plugins/weclaude"
    }
  ]
}
